tweet_id,created_at,username,text,likes,retweets,search_term,views,comments,is_parody ,clean_text
766,2026-07-10,giriftteleb,"Kiralık opsiyonu maç şartına(?) bağlıymış. İnandığınız bir oyuncuyu koşullu mu kiralarsınız, bonservisiyle mi alırsınız? Belli ki 11 için değil, sadece +4 kuralına yapılmış TM etiketli bir hamle. Eleştirilmesi gereken sen veya oyuncu değil, ya tutarsa diyen yönetim.",0,0,hashtagsiz-transfer,358.0,0.0,0.0,kiralık opsiyonu maç şartına bağlıymış i̇nandığınız bir oyuncuyu koşullu mu kiralarsınız bonservisiyle mi alırsınız belli ki için değil sadece kuralına yapılmış tm etiketli bir hamle eleştirilmesi gereken sen veya oyuncu değil ya tutarsa diyen yönetim
767,2026-07-10,asapdoctorisi,"Hakaret edenlerin ortak noktası aynı: Futboldan zerre anlamamaları. Kiralık transfer görünce bile iki aylık beceriksizliği alkışlayacak kadar akılsızlar. Bugün hakaret edenler, yarın ilk mağlubiyette en önde ağlayacak. Bunların ne omurgası var ne de futbol aklı, yazık.",0,0,hashtagsiz-transfer,585.0,0.0,0.0,hakaret edenlerin ortak noktası aynı futboldan zerre anlamamaları kiralık transfer görünce bile iki aylık beceriksizliği alkışlayacak kadar akılsızlar bugün hakaret edenler yarın ilk mağlubiyette en önde ağlayacak bunların ne omurgası var ne de futbol aklı yazık
768,2026-07-10,mrselelebi5670,Mesele bu çocuğun iyi veya kötü olması değil toreyra ve lemina varken şuan elzem olan yer orası değil osimen arkası boş kanat rotasyonun yetersiz stoper sol bek en önemlisi 10 numaran yokken bu değildi şuan acil olan diğerlerini çöz sonra bunu al kimse bişey demez,0,0,hashtagsiz-transfer,577.0,0.0,0.0,mesele bu çocuğun iyi veya kötü olması değil toreyra ve lemina varken şuan elzem olan yer orası değil osimen arkası boş kanat rotasyonun yetersiz stoper sol bek en önemlisi numaran yokken bu değildi şuan acil olan diğerlerini çöz sonra bunu al kimse bişey demez
769,2026-07-10,galicaardi,Hakarete uğramıyorsun yapıcı eleştiriyi kabul etmiyorsun Uğur bey. Bizlerde senin gibi bir taraftarız lakin transfer edebilecek futbolcuyu izlemeden görmeden bu şekilde yorum yapmayı doğru bulmadığını ifade ediyor taraftarlar. Küfür ve argo konuşan içinse ne deseniz haklısınız.,0,0,hashtagsiz-transfer,2000.0,1.0,0.0,hakarete uğramıyorsun yapıcı eleştiriyi kabul etmiyorsun uğur bey bizlerde senin gibi bir taraftarız lakin transfer edebilecek futbolcuyu izlemeden görmeden bu şekilde yorum yapmayı doğru bulmadığını ifade ediyor taraftarlar küfür ve argo konuşan içinse ne deseniz haklısınız
770,2026-07-10,Galaforeve12740,Boş yapma aq! 3-5 ergeni arkana alıp yangın yapıp etkileşim kasacaksın diye hayatında belkide en fazla 5 kere izlediğin adamı bøklamaya çalışıyorsun! Her sezon ağzımı açmam diyorsun arkadan laf kalabılığına devam! Çok samimiysen transfer sezonu bitene kadar yayınlara çıkma!,3,0,hashtagsiz-transfer,1000.0,2.0,0.0,boş yapma aq ergeni arkana alıp yangın yapıp etkileşim kasacaksın diye hayatında belkide en fazla kere izlediğin adamı bøklamaya çalışıyorsun her sezon ağzımı açmam diyorsun arkadan laf kalabılığına devam çok samimiysen transfer sezonu bitene kadar yayınlara çıkma
771,2026-07-10,iritederim,Galatasaray İçin Fikirlerini Söylemiştir Mozambi Alır 20 Daha Verirsin Ağzını Açmaz Uğur Kardeşimin Dediği Gibi İşe Yaramazsa Galatasaray Ambargosu Biter Kardeşim Galatasaray İçin Adam Söyledi Küfür Etmek Nedir,0,0,hashtagsiz-transfer,201.0,0.0,0.0,galatasaray i̇çin fikirlerini söylemiştir mozambi alır daha verirsin ağzını açmaz uğur kardeşimin dediği gibi i̇şe yaramazsa galatasaray ambargosu biter kardeşim galatasaray i̇çin adam söyledi küfür etmek nedir
772,2026-07-10,9IHM9,Sen neyi beğeniyorsun aga işin gücün yönetim eleştirisi yapıp gündemde kalmayı seven yalaka bir gazetecisin sus ve destekle adam gibi lig açılmadan ne eleştirisi amk,1,0,hashtagsiz-transfer,261.0,0.0,0.0,sen neyi beğeniyorsun aga işin gücün yönetim eleştirisi yapıp gündemde kalmayı seven yalaka bir gazetecisin sus ve destekle adam gibi lig açılmadan ne eleştirisi amk
773,2026-07-10,martinpalermooo,"Uğur sen niye böyle oldun kardeşim, gerçekten merak ediyorum. Bir Socrates'te ilk başladığın veya Yenilsen de Yensen de dönemine bakıyorum bir de şimdi geldiğin hale. Samimi olarak çok üzücü. Eminim daha çok para kazanıyorsundur; ama değer miydi bilmiyorum.",0,0,hashtagsiz-transfer,45.0,0.0,0.0,uğur sen niye böyle oldun kardeşim gerçekten merak ediyorum bir socrates te ilk başladığın veya yenilsen de yensen de dönemine bakıyorum bir de şimdi geldiğin hale samimi olarak çok üzücü eminim daha çok para kazanıyorsundur ama değer miydi bilmiyorum
774,2026-07-10,mt_selcuk,"Sen futbol yorumu yapma, hele futbolcu değerlendirmesi hiç yapma. Saçma sapan tesbitler yapıp izlemediğin adam hakkında konuşuyorsun. Galatasarayın ihtiyacı olan ve şartları çok uygun bir futbolcu Ugochukwu. Çok başarılı olacak bizi Ş.LİGİ'nde rahatlatacak.",0,1,hashtagsiz-transfer,65.0,0.0,0.0,sen futbol yorumu yapma hele futbolcu değerlendirmesi hiç yapma saçma sapan tesbitler yapıp izlemediğin adam hakkında konuşuyorsun galatasarayın ihtiyacı olan ve şartları çok uygun bir futbolcu ugochukwu çok başarılı olacak bizi ş li̇gi̇ nde rahatlatacak
775,2026-07-10,Cimbomboom67,Adam haklı beyler. Bi rakiplerinin yaptığı transferlerlere bakın bir de bizimkilere?,0,0,hashtagsiz-transfer,0.0,0.0,0.0,adam haklı beyler bi rakiplerinin yaptığı transferlerlere bakın bir de bizimkilere
776,2026-07-10,Muratgs94,Zaten bu çocuk yedek kulübesi için alınacak ve kiralık gelecek. Beğenmezsen maç sayısını tamamlamazsın oyuncunun opsiyonunu kullanmamış olursun boş konuşuyorsun yok İsmail 3 kat iyi bilmem ne adam premier ligde o fizik ile oynadı burada tutma şanaı yüksek hem de 23 yaşa uygun.,0,0,hashtagsiz-transfer,406.0,1.0,0.0,zaten bu çocuk yedek kulübesi için alınacak ve kiralık gelecek beğenmezsen maç sayısını tamamlamazsın oyuncunun opsiyonunu kullanmamış olursun boş konuşuyorsun yok i̇smail kat iyi bilmem ne adam premier ligde o fizik ile oynadı burada tutma şanaı yüksek hem de yaşa uygun
777,2026-07-10,Eraycanz41,Moruk sen zaten ağzını açma kardeş boş boş konuşuyorsun seni biz ünlü yaptık sende çekip kılıcını bize sallıyorsun 30 milyon Euro görmüş 23 yaşındaki 1.90 çapayı İsmail daha iyi diye kendi aldığımız topçuyu kötülersen sana daha neler der gs taraftarı,3,0,hashtagsiz-transfer,677.0,0.0,0.0,moruk sen zaten ağzını açma kardeş boş boş konuşuyorsun seni biz ünlü yaptık sende çekip kılıcını bize sallıyorsun milyon euro görmüş yaşındaki çapayı i̇smail daha iyi diye kendi aldığımız topçuyu kötülersen sana daha neler der gs taraftarı
778,2026-07-10,turkmilliye,Niye kapıyosun kardeşim ağzını? Bol konuşan bu kadar yönetim yalaması varken. As kadroya 4 5 transfer lazım. Yedek kulübesi boş. Şampiyonlar liginde top diye çevirdiler bizimkileri. Yönetim taraftardan para toplayıp beton yapıyor. Banane oğlum 300 m euro sahadan geri döner mi?,0,0,hashtagsiz-transfer,397.0,0.0,0.0,niye kapıyosun kardeşim ağzını bol konuşan bu kadar yönetim yalaması varken as kadroya transfer lazım yedek kulübesi boş şampiyonlar liginde top diye çevirdiler bizimkileri yönetim taraftardan para toplayıp beton yapıyor banane oğlum m euro sahadan geri döner mi
779,2026-07-10,forgalaforus,"Yahu abi neden insanların fikrini bu kadar umursuyorsun. İnsanlar uzun zaman transfer yapılmadığından ilk premier lig oyuncusuna tabii ki yükselecekler, haliyle sen kötü diyince delirmişler. Senin yorumların, yangının önemli. Lütfen alınganlık yapma.",0,0,hashtagsiz-transfer,720.0,1.0,0.0,yahu abi neden insanların fikrini bu kadar umursuyorsun i̇nsanlar uzun zaman transfer yapılmadığından ilk premier lig oyuncusuna tabii ki yükselecekler haliyle sen kötü diyince delirmişler senin yorumların yangının önemli lütfen alınganlık yapma
780,2026-07-10,AeroGala10,"Istedigini istedigin gibi elestir, kendine laf gelince sov hakaret et sonra elestirilince vay efendim niye boyle bir daha agzimi acmam. Allah askina ac",1,0,hashtagsiz-transfer,255.0,0.0,0.0,istedigini istedigin gibi elestir kendine laf gelince sov hakaret et sonra elestirilince vay efendim niye boyle bir daha agzimi acmam allah askina ac
781,2026-07-10,galafedaisi05,Ya aq yerinde İsmail çöpünü övüyorsan hakareti hak ediyorsun aq İsmail kim aq bizde rotasyon da bile forma giyemez bari atıyorsun destekli at biz istemezmiyiz daha kaliteli orta saha alınsın öyle ha demeyle oluyor mu,7,0,hashtagsiz-transfer,842.0,1.0,1.0,ya aq yerinde i̇smail çöpünü övüyorsan hakareti hak ediyorsun aq i̇smail kim aq bizde rotasyon da bile forma giyemez bari atıyorsun destekli at biz istemezmiyiz daha kaliteli orta saha alınsın öyle ha demeyle oluyor mu
782,2026-07-10,ergunaks,"Uğur geçen sene yorumlarını beğenirdim, ama çok boş yorumlar yapıyorsun 2-3 gündür. Bu transferin nesi kötü? 22 yaş, 2 m kiralık, 23 yaş altı, rotasyon oyuncusu premier lig tecrübesi var, ne istiyorsun anlamadım rotasyona modrif falan mı çekelim",0,0,hashtagsiz-transfer,14.0,0.0,0.0,uğur geçen sene yorumlarını beğenirdim ama çok boş yorumlar yapıyorsun gündür bu transferin nesi kötü yaş m kiralık yaş altı rotasyon oyuncusu premier lig tecrübesi var ne istiyorsun anlamadım rotasyona modrif falan mı çekelim
783,2026-07-10,CimbomluGargi,Kardeşim hakaret yorumları hariç sende bir kere senle aynı düşüncede olmayan insanlara tırı vırı yapma. Herşeyi çok bilmiyorsun. En bilgili sen değilsin. Malum kitlenin elemanları gibi davranmayı bırakıp yapıcı eleştirilere açık ol olamıyorsan da he deyip geçmesini bileceksin,3,0,hashtagsiz-transfer,384.0,0.0,0.0,kardeşim hakaret yorumları hariç sende bir kere senle aynı düşüncede olmayan insanlara tırı vırı yapma herşeyi çok bilmiyorsun en bilgili sen değilsin malum kitlenin elemanları gibi davranmayı bırakıp yapıcı eleştirilere açık ol olamıyorsan da he deyip geçmesini bileceksin
784,2026-07-10,yunofm_,Yq dayı rashicada norwichle kume düşerek geldi öncesinde almanyada küme düşmüştü noldu 22/23 te unuttun mu oyuncuyu sadece kulübü ile yargılıyosun ismail 3kat iyi diyosun seni görcem ben sezon ortası,0,0,hashtagsiz-transfer,342.0,0.0,0.0,yq dayı rashicada norwichle kume düşerek geldi öncesinde almanyada küme düşmüştü noldu te unuttun mu oyuncuyu sadece kulübü ile yargılıyosun ismail kat iyi diyosun seni görcem ben sezon ortası
785,2026-07-10,cimbomm_newss,Sorun şurda oyuncunun ayağı kötü diye eleştiriyosun. İsmail yüksek 3 kat daha iyi diyorsun. İsmail Yükseğin ayağı mı var? Fener güzellemesi yapan herkese tepki verilir. Hakaret doğru değil ama tepkiyi hakediyorsun sonuna kadar.,3,0,hashtagsiz-transfer,529.0,0.0,0.0,sorun şurda oyuncunun ayağı kötü diye eleştiriyosun i̇smail yüksek kat daha iyi diyorsun i̇smail yükseğin ayağı mı var fener güzellemesi yapan herkese tepki verilir hakaret doğru değil ama tepkiyi hakediyorsun sonuna kadar
786,2026-07-10,vakdogan51,Abi sen yüzde yüz haklısın bu yönetim beceriksiz transfer planlaması futbol aklı denilen kavramlar ne Okan buruk ta var ne de yönetimde bunlardan bi cacık olmaz şampiyonda olsalar,1,0,hashtagsiz-transfer,2000.0,0.0,0.0,abi sen yüzde yüz haklısın bu yönetim beceriksiz transfer planlaması futbol aklı denilen kavramlar ne okan buruk ta var ne de yönetimde bunlardan bi cacık olmaz şampiyonda olsalar
787,2026-07-10,ibrahimuhadar8,Çok şükür çok doğru karar vermişsin transferler bitene kadar mümkünse konuşma çünkü 4 sene şampiyon olduk 5.ci yolda,8,0,hashtagsiz-transfer,2000.0,2.0,0.0,çok şükür çok doğru karar vermişsin transferler bitene kadar mümkünse konuşma çünkü sene şampiyon olduk ci yolda
788,2026-07-10,atsnmt1,He deyip geçmemelisin demeyeceğiz sallabaş taraftar olmayacağız ellerinin sıkılmayacağını bilip üç kuruşluk şovmenlere fırsat verenleride takımı kendi çiftlikleri sanan yönetimide teknik direktörüde eleştirip gerekirse göndereceğiz fb gibi paralı köpeklerin kulübü olmayacak GS,2,0,hashtagsiz-transfer,940.0,0.0,0.0,he deyip geçmemelisin demeyeceğiz sallabaş taraftar olmayacağız ellerinin sıkılmayacağını bilip üç kuruşluk şovmenlere fırsat verenleride takımı kendi çiftlikleri sanan yönetimide teknik direktörüde eleştirip gerekirse göndereceğiz fb gibi paralı köpeklerin kulübü olmayacak gs
789,2026-07-10,y_ates232,Bnm açımdan yorumun doğru olmayan yani seni dinleyeb ugochukwu nun 27-28 yasında olmuş bir oyuncu olduğunu düsunecek sekilde yorum yapman. Ayrıca kaç yaşında adamsınız bune küstüm oynamıorum he der geçerim tavırları bu sizi düzgünce takip edenlere büyük saygısızlık!!,0,0,hashtagsiz-transfer,3.0,0.0,0.0,bnm açımdan yorumun doğru olmayan yani seni dinleyeb ugochukwu nun yasında olmuş bir oyuncu olduğunu düsunecek sekilde yorum yapman ayrıca kaç yaşında adamsınız bune küstüm oynamıorum he der geçerim tavırları bu sizi düzgünce takip edenlere büyük saygısızlık
790,2026-07-10,yk87350,Kimse eleştirine bir şey demiyor ama daha oyuncu oynamadan sahaya adımını atmadan mesleği bırakırım gibi laflar ederek sen kendini bu duruma düşürüyorsun mesleği bırakarak kimi tehdit ediyorsun onu da anlamadık bence,1,0,hashtagsiz-transfer,188.0,0.0,0.0,kimse eleştirine bir şey demiyor ama daha oyuncu oynamadan sahaya adımını atmadan mesleği bırakırım gibi laflar ederek sen kendini bu duruma düşürüyorsun mesleği bırakarak kimi tehdit ediyorsun onu da anlamadık bence
791,2026-07-10,forzacimbom,"Kaan Ayhan, Arda Güler, Batshuayi, Altay Bayındır, Murat Dalkılıç gibi isimler, tatilde halı saha maçı yaptı.",1000,20,hashtagsiz-yonetim,273800.0,40.0,0.0,kaan ayhan arda güler batshuayi altay bayındır murat dalkılıç gibi isimler tatilde halı saha maçı yaptı
792,2026-07-10,TvSohbetleri,Kaan Ayhan sezonu burda açyor bize geldiğinde sezonu kapatmış oluyor,2,0,hashtagsiz-yonetim,412.0,0.0,0.0,kaan ayhan sezonu burda açyor bize geldiğinde sezonu kapatmış oluyor
793,2026-07-10,metaglyph1,"sanki bütün sene oynadı da paşa tatil yapıyor hala,sözde bayern oluyoruz diye kendimizi kandırıyoruz zununla beraber ahmet kutucuyu kadroda takliyor üstüne kadroda 3 tane kanat oyuncusu var yeminle, böyle basiretsiz başarısız yönetim olamaz",0,1,hashtagsiz-yonetim,1000.0,0.0,0.0,sanki bütün sene oynadı da paşa tatil yapıyor hala sözde bayern oluyoruz diye kendimizi kandırıyoruz zununla beraber ahmet kutucuyu kadroda takliyor üstüne kadroda tane kanat oyuncusu var yeminle böyle basiretsiz başarısız yönetim olamaz
794,2026-07-10,i3royzan,Kaan ayhan niye Kampta değil mesela çok mu yorulmuş bu sene,194,0,hashtagsiz-yonetim,6000.0,1.0,0.0,kaan ayhan niye kampta değil mesela çok mu yorulmuş bu sene
795,2026-07-10,_unvaniyeil_,"şu ÜNLÜ SEVİCİLİĞİ bi bitse, bunların hiç bir halt olmadığı anlaşılacak. Adamlar köşeyi dönüyor, bunları destekleyenler sefalet içinde yaşıyor. Olum ne komik insanlarsınız siz yaa",4,0,hashtagsiz-yonetim,1000.0,0.0,0.0,şu ünlü sevi̇ci̇li̇ği̇ bi bitse bunların hiç bir halt olmadığı anlaşılacak adamlar köşeyi dönüyor bunları destekleyenler sefalet içinde yaşıyor olum ne komik insanlarsınız siz yaa
796,2026-07-10,Sato555at,Kaan beye bak. Şampiyona da çok mu yoruldun aslanım! Kampa geç geliyor beyefendi.. Mümkünse oradan da başka yere gönderilsin!!,35,0,hashtagsiz-yonetim,3000.0,1.0,0.0,kaan beye bak şampiyona da çok mu yoruldun aslanım kampa geç geliyor beyefendi mümkünse oradan da başka yere gönderilsin
797,2026-07-10,babyf9659,"Beyler mesela Kaan Ayhan neyin ekstra tatilini yapıyor biri anlatabilir mi bana ? Amerika'da da tatil yapıp geldi zaten. En önemsiz maçlarda gol atıp birinde deli gibi sevinir, ligde attığında da karnısı sümük ağlıyordu sanki çok başkaya uğramışlar gibi valla komik geliyor",0,0,hashtagsiz-yonetim,1000.0,0.0,0.0,beyler mesela kaan ayhan neyin ekstra tatilini yapıyor biri anlatabilir mi bana amerika da da tatil yapıp geldi zaten en önemsiz maçlarda gol atıp birinde deli gibi sevinir ligde attığında da karnısı sümük ağlıyordu sanki çok başkaya uğramışlar gibi valla komik geliyor
798,2026-07-10,boylesinesfilr1,Kaani bile göndermiyor aq yerine birini almamak için uğraşmak rezil ötesi bir takım haline dönüştük bonservis vermemek için eldeklere sürekli zam bailli kaymaklı sözlesme. Performansta hiç önemli değil yeterki yer açilpta transfer istenmesin,12,0,hashtagsiz-yonetim,1000.0,0.0,0.0,kaani bile göndermiyor aq yerine birini almamak için uğraşmak rezil ötesi bir takım haline dönüştük bonservis vermemek için eldeklere sürekli zam bailli kaymaklı sözlesme performansta hiç önemli değil yeterki yer açilpta transfer istenmesin
799,2026-07-10,Mustafa8914733,altay'ı rejinders sandım o nasıl bir benzerlik amk,9,0,hashtagsiz-yonetim,1000.0,0.0,0.0,altay ı rejinders sandım o nasıl bir benzerlik amk
800,2026-07-10,orhnkrmn22,eeee ? ne yapalım ? haber mi yaptın sen şimdi?,0,0,hashtagsiz-yonetim,1000.0,0.0,0.0,eeee ne yapalım haber mi yaptın sen şimdi
801,2026-07-10,TuncallMustafa,Halı saha maçında Arda Güler'i marke etmeye çalışmak nasıl bir şeydir ya?,0,0,hashtagsiz-yonetim,2000.0,0.0,0.0,halı saha maçında arda güler i marke etmeye çalışmak nasıl bir şeydir ya
802,2026-07-10,cheocly,10 temmuz olmuş hala reğinumda tatil yapıyorsunuz size topçu diyenin amk ya,4,0,hashtagsiz-yonetim,1000.0,0.0,0.0,temmuz olmuş hala reğinumda tatil yapıyorsunuz size topçu diyenin amk ya
803,2026-07-10,aliyilmaz_,"İcardi ile vedalaşma yazısı ne yazılacak? Bu kaan ayhan, ahmed kutucu, jelert, ağır lemina, günay bu adamlarla ne zaman vedalaşacak? Sol stoper, 10 numara, 6 numara, 2. Forvet, kanat çalışma var mı ? Kulüpte futbol aklı yok",0,0,hashtagsiz-yonetim,530.0,0.0,0.0,i̇cardi ile vedalaşma yazısı ne yazılacak bu kaan ayhan ahmed kutucu jelert ağır lemina günay bu adamlarla ne zaman vedalaşacak sol stoper numara numara forvet kanat çalışma var mı kulüpte futbol aklı yok
804,2026-07-10,cheocly,En sonunda tesisi basıp kaanı tekme tokat dövüp yollayacaz başka seçenek bırakmıyo,5,0,hashtagsiz-yonetim,1000.0,0.0,0.0,en sonunda tesisi basıp kaanı tekme tokat dövüp yollayacaz başka seçenek bırakmıyo
805,2026-07-10,beyzaduman1345,Şu Kaan Ayhan'ı gönderecek bi adam yok mu,31,0,hashtagsiz-yonetim,1000.0,0.0,0.0,şu kaan ayhan ı gönderecek bi adam yok mu
806,2026-07-10,hisseden_kissa,Kaan bu ne kilo ya. İnsanın az işine kendisine saygısı olur aq.,0,2,hashtagsiz-yonetim,571.0,0.0,0.0,kaan bu ne kilo ya i̇nsanın az işine kendisine saygısı olur aq
807,2026-07-10,Cimbommbombm,dalkılıç woldemort gibi olmuş yemin ederim.,0,0,hashtagsiz-yonetim,472.0,0.0,0.0,dalkılıç woldemort gibi olmuş yemin ederim
808,2026-07-10,genzo_w99,Kaos show mu bu amk nasıl ortam lan,0,0,hashtagsiz-yonetim,1000.0,0.0,0.0,kaos show mu bu amk nasıl ortam lan
809,2026-07-10,Akcay_jenk,Kaan Ayhan'ın kaç yıl daha sözleşmesi var bilmiyorum ama futbolu çoktan bıkrakmış olduğunu biliyorum,0,0,hashtagsiz-yonetim,13.0,0.0,0.0,kaan ayhan ın kaç yıl daha sözleşmesi var bilmiyorum ama futbolu çoktan bıkrakmış olduğunu biliyorum
810,2026-07-10,mucizecasper,Ardavın Murat dalkılıçla oynayacak kadar kendine güvenmesini istemiyorum Oğlum gelir basar adelene uğraş dur,1,0,hashtagsiz-yonetim,125.0,0.0,1.0,ardavın murat dalkılıçla oynayacak kadar kendine güvenmesini istemiyorum oğlum gelir basar adelene uğraş dur
811,2026-07-10,berkkoooo,Kaan zaten emekli olmuş kampa bile almayın,0,0,hashtagsiz-yonetim,16.0,0.0,0.0,kaan zaten emekli olmuş kampa bile almayın
812,2026-07-10,kong75370442,Ağ Murat Dalkiç bile kaandan daha fit,7,0,hashtagsiz-yonetim,28.0,0.0,0.0,ağ murat dalkiç bile kaandan daha fit
813,2026-07-10,Haticebyrmctnky,Futbolcu da olsan halı sahanın tadını vermiyor galiba :)),0,0,hashtagsiz-yonetim,87.0,0.0,0.0,futbolcu da olsan halı sahanın tadını vermiyor galiba
814,2026-07-10,Bacart15,Batshuayi nereden çıkmış,0,0,hashtagsiz-yonetim,915.0,0.0,0.0,batshuayi nereden çıkmış
815,2026-07-10,Isaobxjo,Galatasarayın yeni transferleri yolda,0,0,hashtagsiz-yonetim,3.0,0.0,0.0,galatasarayın yeni transferleri yolda
816,2026-07-10,david_alperenf14,kadroyu hayrettin falanmı topladı,0,0,hashtagsiz-yonetim,33.0,0.0,0.0,kadroyu hayrettin falanmı topladı
817,2026-07-10,icardi_m9,Raşit gezzal var amk,0,0,hashtagsiz-yonetim,276.0,0.0,0.0,raşit gezzal var amk
818,2026-07-10,Yfsft96,Dalkılıç ne alaka onu anlamadım,0,1,hashtagsiz-yonetim,583.0,0.0,0.0,dalkılıç ne alaka onu anlamadım
819,2026-07-10,sligokturk,kaan neden kampta değil de halı sahada amk,2,0,hashtagsiz-yonetim,916.0,1.0,0.0,kaan neden kampta değil de halı sahada amk
820,2026-07-10,thattrttr,kadronun alaka,0,0,hashtagsiz-yonetim,132.0,0.0,0.0,kadronun alaka
821,2026-07-10,fyanolr,BU NASIL Bİ EKİP AMK,0,0,hashtagsiz-yonetim,304.0,1.0,0.0,bu nasil bi̇ eki̇p amk
822,2026-07-10,KaretecliJoe_,Ghezzal mi o ne alaka amk,0,0,hashtagsiz-yonetim,288.0,0.0,0.0,ghezzal mi o ne alaka amk
823,2026-07-10,DriessLucca,Ghezzalda varmış,0,0,hashtagsiz-yonetim,0.0,0.0,0.0,ghezzalda varmış
824,2026-07-10,Araswl7,gheazalda var sanki,0,0,hashtagsiz-yonetim,609.0,0.0,0.0,gheazalda var sanki
825,2026-07-10,omerfarukk_50,Ekibin alaka seviyesi,0,0,hashtagsiz-yonetim,25.0,0.0,0.0,ekibin alaka seviyesi
826,2026-07-10,GalatasaraySK,"Yeni sezon öncesi ilk hazırlık maçı! Galatasaray ile E. Ümraniyespor, 17 Temmuz Cuma günü saat 21.00'de Ümraniye Şehir Stadyumu'nda özel bir hazırlık karşılaşması yapacaktır.",5600,146,hashtagsiz-hazirlikmaci,152000.0,125.0,0.0,yeni sezon öncesi ilk hazırlık maçı galatasaray ile e ümraniyespor temmuz cuma günü saat de ümraniye şehir stadyumu nda özel bir hazırlık karşılaşması yapacaktır
827,2026-07-10,NbasfNiyazi,Rakiplerin sürekli 3 er 4 er adam alıp dünya yıldızları gündemdeyken sen gene elin boş geziyorsun. Bir kerede futbolcular kampa girmeden alın getirin adam akıllı kamp yesin sezona hazır olsun bir kere ya. Yazıklar olsun,2,0,hashtagsiz-yonetim,307.0,1.0,0.0,rakiplerin sürekli er er adam alıp dünya yıldızları gündemdeyken sen gene elin boş geziyorsun bir kerede futbolcular kampa girmeden alın getirin adam akıllı kamp yesin sezona hazır olsun bir kere ya yazıklar olsun
828,2026-07-10,GS1905Denizbaba,Forvette Ahmet Kutucu mu olacak. Sezonun başlamasına 1 ay var ne bir hareket.Garip garip isimler transfer haberlerinde çıkıyor.Bu kadar rahatlıkta fazla değilmi,0,0,hashtagsiz-yonetim,104.0,0.0,0.0,forvette ahmet kutucu mu olacak sezonun başlamasına ay var ne bir hareket garip garip isimler transfer haberlerinde çıkıyor bu kadar rahatlıkta fazla değilmi
829,2026-07-10,Burak34309,Hayaller camavinga bruno gerçekler ugochwku gerçekten söyleyecek bir şey bulamıyorum,0,0,hashtagsiz-yonetim,805.0,2.0,0.0,hayaller camavinga bruno gerçekler ugochwku gerçekten söyleyecek bir şey bulamıyorum
830,2026-07-10,zatilgan41,Forvette kimi oynayacak !???? İcardiyi gönderdin yeter. Leminayi gönderin. Lesley ile kandıramazsınız taraftarı,3,0,hashtagsiz-yonetim,1000.0,1.0,0.0,forvette kimi oynayacak i̇cardiyi gönderdin yeter leminayi gönderin lesley ile kandıramazsınız taraftarı
831,2026-07-10,TakketiTavuk,Bu maça seninle çıkmak istiyorum ya,1000,30,hashtagsiz-hazirlikmaci,0.0,4.0,1.0,bu maça seninle çıkmak istiyorum ya
832,2026-07-10,KADIR_X7,Lütfen hiçbir kanalda yayınlanmasın görmek istemiyoruz. Takımda hiç görmediğimiz futbolcularla yapılacak bir antrenman maçı olacak. Bunu yayınlamanız bile kriterlerinizin altında,3,0,hashtagsiz-hazirlikmaci,357.0,0.0,0.0,lütfen hiçbir kanalda yayınlanmasın görmek istemiyoruz takımda hiç görmediğimiz futbolcularla yapılacak bir antrenman maçı olacak bunu yayınlamanız bile kriterlerinizin altında
833,2026-07-10,metinerdasun,Allahım lütfen beş tane gol yiyelim,0,0,hashtagsiz-hazirlikmaci,32.0,0.0,0.0,allahım lütfen beş tane gol yiyelim
834,2026-07-10,Enesah602761964,nerden bilet alabilirz veya biya bilet almamıza gerek var mı geçen sene nasıldı,1,0,hashtagsiz-hazirlikmaci,825.0,2.0,0.0,nerden bilet alabilirz veya biya bilet almamıza gerek var mı geçen sene nasıldı
835,2026-07-10,notoozniariaz2,Bu nasıl tasarımlar. Kandil-cuma tasarımları gibi? adam akıllı yapın şu tasarımları etkili güçlü kırmızı ağırlıkta olsun. Herşeyi turuncuya çevirmişsiniz,2,0,hashtagsiz-hazirlikmaci,150.0,1.0,0.0,bu nasıl tasarımlar kandil cuma tasarımları gibi adam akıllı yapın şu tasarımları etkili güçlü kırmızı ağırlıkta olsun herşeyi turuncuya çevirmişsiniz
836,2026-07-10,Jaderhaso,İnsallah umraniye bize 8 atarda aklınız başınıza gelir yönetim.,1,0,hashtagsiz-yonetim,303.0,0.0,1.0,i̇nsallah umraniye bize atarda aklınız başınıza gelir yönetim
837,2026-07-10,BSuSsBt11,"Düzgün transferler yapılmazsa bu sezon çok zor şampiyonluk ,ne oyuncu gönderiyoruz nede oyuncu alıyoruz",1,0,hashtagsiz-yonetim,695.0,0.0,0.0,düzgün transferler yapılmazsa bu sezon çok zor şampiyonluk ne oyuncu gönderiyoruz nede oyuncu alıyoruz
