tweet_id,created_at,username,text,likes,retweets,search_term,views,comments,is_parody ,clean_text
585,2026-06-24,Mesutztrk34,"Ajitasyon ve algıdan beslenen, sözde mağduriyetlerini 7/24 taze tutup gündem oluşturmaya çalışan bir güruh. Yaranmak mümkün değil. Bize her gün ceza kesilsin. Yıldızlarımız sökülüp onlara verilsin, şampiyonluklar altın tepside sunulsun. Belki bir süre ağlamayı bırakırlar.",0,0,#GalatasaraySK+#transfermerededursunözbek+#HainsinDursunÖzbek,19.0,0.0,0.0,ajitasyon ve algıdan beslenen sözde mağduriyetlerini taze tutup gündem oluşturmaya çalışan bir güruh yaranmak mümkün değil bize her gün ceza kesilsin yıldızlarımız sökülüp onlara verilsin şampiyonluklar altın tepside sunulsun belki bir süre ağlamayı bırakırlar
586,2026-07-10,_denizcimbom,"Bu oyuncuya çöp diyorlar, Carlos Balwbatı alın. @GalatasaraySK",0,0,#GalatasaraySK+#transfermerededursunözbek+#HainsinDursunÖzbek,0.0,0.0,1.0,bu oyuncuya çöp diyorlar carlos balwbatı alın
587,2026-06-08,Gala5353,"Çöp olan bir oyuncu nasıl geçen sezon 30 küsür maç oynamış? Premier ligde biraz mantıklı olun, 20 yaşında Premier Lig'e gitmiş, 22 yaşında üstelik.",0,0,#GalatasaraySK+#transfermerededursunözbek+#HainsinDursunÖzbek,1.0,0.0,0.0,çöp olan bir oyuncu nasıl geçen sezon küsür maç oynamış premier ligde biraz mantıklı olun yaşında premier lig e gitmiş yaşında üstelik
588,2026-05-31,GALATASARAY_fa,#Galatasaray yeni transferi Kazakistan ve İtalyan karma asıllı futbolcu Şahanov Recepivit ivetto ile 9 yıllık sözleşme imzalayacak. Yıldız futbolcu yarın 21:00'de Yeşilköy havalimanında olacak. #DursunÖzbekTransferlerNerede,2,0,#GalatasaraySK+#transfermerededursunözbek+#HainsinDursunÖzbek,74.0,0.0,1.0,galatasaray yeni transferi kazakistan ve i̇talyan karma asıllı futbolcu şahanov recepivit ivetto ile yıllık sözleşme imzalayacak yıldız futbolcu yarın de yeşilköy havalimanında olacak dursunözbektransferlernerede
589,2026-07-10,SerAnaliz,Transfer isteyen taraftara troll diyen ne kadar gazeteci varsa Galatasaray yönetiminin paralı kalemleridir... Gsray hissesini bedelli sermaye artırımı yapıp hissedarlardan para almak için...,1,0,#GalatasaraySK+#transfermerededursunözbek+#HainsinDursunÖzbek,241.0,0.0,0.0,transfer isteyen taraftara troll diyen ne kadar gazeteci varsa galatasaray yönetiminin paralı kalemleridir gsray hissesini bedelli sermaye artırımı yapıp hissedarlardan para almak için
590,2026-07-05,ErdincGurcam,"Bizim için bu yıl çok önemli. Seçime rakipsiz girip başkan olman hiç önemli değil. Transfer işlerinde halimiz simitçi, kahveci, gazozcu modu. Parada var nerede transferler. Kampa neden tam kadro katılamıyoruz. Son maçları, ne kadar zorlandığımızı hatırlatırım. #TransferlerNerede",0,0,#GalatasaraySK+#transfermerededursunözbek+#HainsinDursunÖzbek,0.0,0.0,0.0,bizim için bu yıl çok önemli seçime rakipsiz girip başkan olman hiç önemli değil transfer işlerinde halimiz simitçi kahveci gazozcu modu parada var nerede transferler kampa neden tam kadro katılamıyoruz son maçları ne kadar zorlandığımızı hatırlatırım transferlernerede
591,2026-06-07,10cagannn,"Galatasaray kesin olarak 1 tane stoper transferi yapacak, Singo ya da Davinson Sanchez'in ayrılması durumunda yabancı kalmaları durumunda Türk bir oyuncu alınacak. Yabancı oyuncu için U23 düşünülürken, Türk oyuncu için Yusuf Akçiçek listede ilk sırada.",15,0,#GalatasaraySK+#transfermerededursunözbek+#HainsinDursunÖzbek,0.0,0.0,0.0,galatasaray kesin olarak tane stoper transferi yapacak singo ya da davinson sanchez in ayrılması durumunda yabancı kalmaları durumunda türk bir oyuncu alınacak yabancı oyuncu için u düşünülürken türk oyuncu için yusuf akçiçek listede ilk sırada
592,2026-07-01,piccolalacrima,Son 4 yılın şampiyonu hala transfer yapmadı. Sözde piyasa değerimizi 500mn yapacaktık. Transferler nerede? #hainsindursunözbek #DursunÖzbekParalarNerede #DursunÖzbekTransferlerNerede #DursunÖzbekistifa #OkanBurukİstifa,3,0,#GalatasaraySK+#transfermerededursunözbek+#HainsinDursunÖzbek,474.0,0.0,0.0,son yılın şampiyonu hala transfer yapmadı sözde piyasa değerimizi mn yapacaktık transferler nerede hainsindursunözbek dursunözbekparalarnerede dursunözbektransferlernerede dursunözbekistifa okanburuki̇stifa
593,2026-06-21,mvelzy,Rakipler transfer yaparken Galatasaray'ın rahatlık.,2,0,#GalatasaraySK+#transfermerededursunözbek+#HainsinDursunÖzbek,29.0,0.0,0.0,rakipler transfer yaparken galatasaray ın rahatlık
594,2026-07-05,GalatasaraySK,"Galatasarayımızın, Avusturya'da gerçekleştireceği hazırlık kampında oynayacağı maçların BİLETLERİ SATIŞTA! @matchpr_ organizasyonuyla düzenlenen kampta takımımız, biri Summer Series Upper Austria kapsamında olmak üzere iki maça çıkacak. İlk maçında 24 Temmuz Cuma günü...",8000,251,#okanburuk+#abdullahkavukcu,457000.0,1000.0,0.0,galatasarayımızın avusturya da gerçekleştireceği hazırlık kampında oynayacağı maçların bi̇letleri̇ satişta organizasyonuyla düzenlenen kampta takımımız biri summer series upper austria kapsamında olmak üzere iki maça çıkacak i̇lk maçında temmuz cuma günü
595,2026-07-06,MBasgan1905,#dursunözbek transferler nerede? #abdullahkavukcu #OkanBuruk @okanburuk @abdullahkavukcu,0,0,#okanburuk+#abdullahkavukcu,13.0,0.0,0.0,dursunözbek transferler nerede abdullahkavukcu okanburuk
596,2026-07-06,19UltraGs05,Bizim dursun özbek ve abdullah kavukçu beceriksizdir!!! Erden Timur'un meyvesini yeyip sonra arkasından kuyusunu kazdılar!!!,2,2,#okanburuk+#abdullahkavukcu,125.0,0.0,0.0,bizim dursun özbek ve abdullah kavukçu beceriksizdir erden timur un meyvesini yeyip sonra arkasından kuyusunu kazdılar
597,2026-07-05,FollwTheLeader,Peki şunu yapmak çok mu zor?,572,12,#okanburuk+#abdullahkavukcu,22000.0,21.0,1.0,peki şunu yapmak çok mu zor
598,2026-07-07,x_Fesli_x,"Bu adam bile kilo almış ya...ABV sizin...Takımda sıfır ciddiyet, sıfır profesyonellik, sıfır disiplin... #OkanBurukIstifa",505,68,#okanburuk+#abdullahkavukcu,7000.0,23.0,1.0,bu adam bile kilo almış ya abv sizin takımda sıfır ciddiyet sıfır profesyonellik sıfır disiplin okanburukistifa
599,2026-07-08,VO_45_,Şu tabloya bakınca 4 senedir şampiyon yapan teknik direktörüne haksızlık yapan bir başkan görüyorum Fenerbahçe'de bizden de fazla maaş veriyor toplamında inanılmaz yani ben bu tabloda dursun Özbek'e rağmen şampiyon olan bir takım görüyorum,0,0,#okanburuk+#abdullahkavukcu,0.0,0.0,1.0,şu tabloya bakınca senedir şampiyon yapan teknik direktörüne haksızlık yapan bir başkan görüyorum fenerbahçe de bizden de fazla maaş veriyor toplamında inanılmaz yani ben bu tabloda dursun özbek e rağmen şampiyon olan bir takım görüyorum
600,2026-07-08,VO_45_,Galatasaray başkanı Galatasaraya ve Okan buruka haksızlık ve ayıp ediyor rakiplerinin başarısız teknik direktörlere harcadığı paraları görünce seni şampiyonlar Ligi'nde son 16'ya taşımış ligde 4 sene şampiyon yapmış adamın istediklerini alın parasına bakmadan,0,0,#okanburuk+#abdullahkavukcu,41.0,0.0,1.0,galatasaray başkanı galatasaraya ve okan buruka haksızlık ve ayıp ediyor rakiplerinin başarısız teknik direktörlere harcadığı paraları görünce seni şampiyonlar ligi nde son ya taşımış ligde sene şampiyon yapmış adamın istediklerini alın parasına bakmadan
601,2026-07-07,SuleymanRodop,Galatasaray'da Jhon Duran'ın bekletilme sebeplerinden biri Bertuğ Yıldırım ihtimali.,781,36,#okanburuk+#abdullahkavukcu,68000.0,302.0,0.0,galatasaray da jhon duran ın bekletilme sebeplerinden biri bertuğ yıldırım ihtimali
602,2026-07-07,ABK_GS,"Ben size okan. Uruk futboldan futbolcudan kadro kurmaktan zerre anlamaz dediğimde bana gülenler,kızanlar dalga geçenler...buyrun size okan burukun futbol aklı!!! Bertuğ için duranı bekletmek, bertuğu almayı düşünmek!!! Görün gs nin başındaki işbilmez vasıfsızın halini",0,0,#okanburuk+#abdullahkavukcu,106.0,0.0,0.0,ben size okan uruk futboldan futbolcudan kadro kurmaktan zerre anlamaz dediğimde bana gülenler kızanlar dalga geçenler buyrun size okan burukun futbol aklı bertuğ için duranı bekletmek bertuğu almayı düşünmek görün gs nin başındaki işbilmez vasıfsızın halini
603,2026-07-08,astemirey,@sgokbakar'ın yanındayız @abdullahkavukcu denen şahıs ya ayağını denk alsın yada defolup gitsin bu kulüpten her taşın altından o çıkıyor. Hem beceriksiz hem de her ota nane oluyor.. @GalatasaraySK,0,0,#okanburuk+#abdullahkavukcu,0.0,0.0,0.0,ın yanındayız denen şahıs ya ayağını denk alsın yada defolup gitsin bu kulüpten her taşın altından o çıkıyor hem beceriksiz hem de her ota nane oluyor
604,2026-07-06,ultras034,"Şu platform dahil, Ülkemizde transfer işinin hakkını verebilecek 5-6 dil konuşan terminatör gibi gençler varken, sırf Okan Burukla arkadaş diye Abdullah Kavukçuya bizi muhtaç eden hayatın ta awk. #DursunÖzbekTransferlerNerede",0,0,#okanburuk+#abdullahkavukcu,32.0,0.0,0.0,şu platform dahil ülkemizde transfer işinin hakkını verebilecek dil konuşan terminatör gibi gençler varken sırf okan burukla arkadaş diye abdullah kavukçuya bizi muhtaç eden hayatın ta awk dursunözbektransferlernerede
605,2026-07-06,PesindeyizApp,"Uğur Karakullukçu: 'Ya Galatasaray'da hiç mi bir şey olmaz ya! Sıfır yani!' Mesela daha Jankat kalıyor mu, gidiyor mu bu belli değil. Ya daha sen kendi oyuncunla görüşmekten acizsin! Ya böyle bir saçmalık olur mu? Gidecekler belli değil. Günay kalıyor mu, gidiyor mu? Kaan...",2000,216,#okanburuk+#abdullahkavukcu,229000.0,108.0,0.0,uğur karakullukçu ya galatasaray da hiç mi bir şey olmaz ya sıfır yani mesela daha jankat kalıyor mu gidiyor mu bu belli değil ya daha sen kendi oyuncunla görüşmekten acizsin ya böyle bir saçmalık olur mu gidecekler belli değil günay kalıyor mu gidiyor mu kaan
606,2026-07-06,ABK_GS,"Bütün bu rezilliklerin 1 numaralı sorumlusu OKAN BURUK denen pısırık,aciz,futbolcudan zerre anlamayan,takım kurmayı sistemi taktiği zerre bilmeyen adamdır (gülerek!!!!)",0,0,#okanburuk+#abdullahkavukcu,115.0,0.0,0.0,bütün bu rezilliklerin numaralı sorumlusu okan buruk denen pısırık aciz futbolcudan zerre anlamayan takım kurmayı sistemi taktiği zerre bilmeyen adamdır gülerek
607,2026-07-10,ftwdebruyne,3 ay önce Fransa u21 ile maçlara çıkan adama fazla çöp çekiliyor. Oyunumuza uygun değil vs yorumlar kabul edilebilir şu eksik bu eksik denilebilir ama çok garip yorumlar var. Fransa'nın bile beklentisi olan bir adam.,480,7,#okanburuk+#abdullahkavukcu,15000.0,27.0,1.0,ay önce fransa u ile maçlara çıkan adama fazla çöp çekiliyor oyunumuza uygun değil vs yorumlar kabul edilebilir şu eksik bu eksik denilebilir ama çok garip yorumlar var fransa nın bile beklentisi olan bir adam
608,2026-07-10,Kutluk_Tarkan,Beni tek umutlandıran olay şu görüntü fransa ve ingilterede oynayan bir oyuncu için çok iyi. Sadece tereddütlerim var ve okan hocanın ne istediğinin belirsizliği canımı sıkıyor. 3 savunma oynayacağım diye 10 transfer yaptı oynayamadı,0,0,#okanburuk+#abdullahkavukcu,0.0,0.0,1.0,beni tek umutlandıran olay şu görüntü fransa ve ingilterede oynayan bir oyuncu için çok iyi sadece tereddütlerim var ve okan hocanın ne istediğinin belirsizliği canımı sıkıyor savunma oynayacağım diye transfer yaptı oynayamadı
609,2026-07-05,Alpzen8,Transferler nerede? @GalatasaraySK @okanburuk #DursunÖzbekTransferlerNerede #okanburuk #abdullahkavukcu #GalatasarayaTransferLazım,0,0,#okanburuk+#abdullahkavukcu,0.0,0.0,0.0,transferler nerede dursunözbektransferlernerede okanburuk abdullahkavukcu galatasarayatransferlazım
610,2026-07-05,ercihanGs1905,Her zaman olduğu gibi bugün de görüyoruz ki @GalatasaraySK yönetimi taraftarı yine uyutuyor #okanburuk da kendilerine kalkan oluyor.! @abdullahkavukcu muhabirlere üst perdeden oyuncu isimleri fısıldıyor sonra da 40 bahane ile o oldu bu oldu! #TransferlerNeredeDursunÖzbek,0,0,#okanburuk+#abdullahkavukcu,9.0,0.0,0.0,her zaman olduğu gibi bugün de görüyoruz ki yönetimi taraftarı yine uyutuyor okanburuk da kendilerine kalkan oluyor muhabirlere üst perdeden oyuncu isimleri fısıldıyor sonra da bahane ile o oldu bu oldu transferlernerededursunözbek
611,2026-07-05,fthzora,Avrupa'da başarı isteniyorsa amatör küçük çaplı düşünen okan burukla olmaz. Jürgen Klopp boştayken alın gelin yarı finalden önce elenmeyelim. Bu yönetimle hiç olmaz beceriksiz basiretsiz cahil yönetim #yönetimistifa #dursunözbekistifa #abdullahkavukçuistifa #okanburukistifa,3,2,#okanburuk+#abdullahkavukcu,160.0,1.0,0.0,avrupa da başarı isteniyorsa amatör küçük çaplı düşünen okan burukla olmaz jürgen klopp boştayken alın gelin yarı finalden önce elenmeyelim bu yönetimle hiç olmaz beceriksiz basiretsiz cahil yönetim yönetimistifa dursunözbekistifa abdullahkavukçuistifa okanburukistifa
612,2026-07-08,Tekyol_Gs1905,ŞU GÖRÜNTÜNÜN AÇIKLAMASI YOK. Galatasarayın Suç duyurusunda bulunulması şarttır. Bu gibi hareketlere Prim verilirse sürekli yaşanır. @1905hukukcular @GSHP1905 @GalatasaraySK,3000,467,#okanburuk+#abdullahkavukcu,1000000.0,1000.0,0.0,şu görüntünün açiklamasi yok galatasarayın suç duyurusunda bulunulması şarttır bu gibi hareketlere prim verilirse sürekli yaşanır
613,2026-07-09,Arabistan_carsi,Kesin sesinizi haddinizi bilin ve hukukçulara çağrıda bulunan hadsiz sayfa şayet hukuki süreç başlarsa dosyaya bu görüntülerde eklensin adalet ya herkese ya hiç kimseye terazi şaşmasın istiyorsanız Okan buruk da yargılanmalı ve ona eşlik eden taraftar da yargılanmalı,0,0,#okanburuk+#abdullahkavukcu,0.0,0.0,0.0,kesin sesinizi haddinizi bilin ve hukukçulara çağrıda bulunan hadsiz sayfa şayet hukuki süreç başlarsa dosyaya bu görüntülerde eklensin adalet ya herkese ya hiç kimseye terazi şaşmasın istiyorsanız okan buruk da yargılanmalı ve ona eşlik eden taraftar da yargılanmalı
614,2026-07-04,GSMark_,"Okan buruk istifa. Sürekli izin sürekli tatil gece alemleri.. TV programları. Takıma katkısı yok. Kaliteli oyuncularla şampiyonluk kazandı. Takım oyunu, futbol zekası teknik taktik analiz, oyuncu değişikliği hiç birşey bilmiyor. #DursunÖzbekistifa #IcardiyeVefaDeğilVeda",0,0,#okanburuk+#abdullahkavukcu,44.0,0.0,0.0,okan buruk istifa sürekli izin sürekli tatil gece alemleri tv programları takıma katkısı yok kaliteli oyuncularla şampiyonluk kazandı takım oyunu futbol zekası teknik taktik analiz oyuncu değişikliği hiç birşey bilmiyor dursunözbekistifa icardiyevefadeğilveda
615,2026-07-05,samiyengundem,"Okan Buruk: Hedefimiz üst üste 5. şampiyonluk ve Avrupa'da başarı. Bu sezon, geçen sezonlara nazaran önümüzü görerek hareket etmek istiyoruz. Çok büyük bir beklentiye girmemek gerekiyor.",188,29,#okanburuk+#abdullahkavukcu,83000.0,102.0,0.0,okan buruk hedefimiz üst üste şampiyonluk ve avrupa da başarı bu sezon geçen sezonlara nazaran önümüzü görerek hareket etmek istiyoruz çok büyük bir beklentiye girmemek gerekiyor
616,2026-07-05,omerfcan06,Okan Buruk kankası Kavukçu'yu koruma altına almış ama bu sene çok büyük rezil olacak farkında değil. Samiyenhaber burhan alinaci haluk da onu kurtaramayacak!,0,0,#okanburuk+#abdullahkavukcu,63.0,0.0,0.0,okan buruk kankası kavukçu yu koruma altına almış ama bu sene çok büyük rezil olacak farkında değil samiyenhaber burhan alinaci haluk da onu kurtaramayacak
617,2026-07-05,Diyojen1905,"Galatasaray amatör dursun Özbek okan buruk ve diğer amatör yöneticilerden kurtulması gerekiyor @okanburuk OKAN EFENDİ, ne çabuk unuttun geçen seneki kötü futbolu? Kapanan hiçbir takımı açamadın! Senin kötü bir teknik direktör olduğunu çoğu insan evladı biliyor.",0,0,#okanburuk+#abdullahkavukcu,57.0,0.0,0.0,galatasaray amatör dursun özbek okan buruk ve diğer amatör yöneticilerden kurtulması gerekiyor okan efendi̇ ne çabuk unuttun geçen seneki kötü futbolu kapanan hiçbir takımı açamadın senin kötü bir teknik direktör olduğunu çoğu insan evladı biliyor
618,2026-07-04,MertSevinc3506,@Haluk_Yurekli bunu haber haline getirdiyse @okanburuk teknik heyetine yeni adam istemiyor demektir. @abdullahkavukcu istiyor ama hoca istemiyor demektir. Bu nedenle @Haluk_Yurekli haber yaptırmış taraftar bu konun üstüne gitsin diye. Teknik heyet güçlendirilmez ise yandık.,0,0,#okanburuk+#abdullahkavukcu,13.0,0.0,0.0,bunu haber haline getirdiyse teknik heyetine yeni adam istemiyor demektir istiyor ama hoca istemiyor demektir bu nedenle haber yaptırmış taraftar bu konun üstüne gitsin diye teknik heyet güçlendirilmez ise yandık
619,2026-07-04,Haluk_Yurekli,"Galatasaray'da neler oluyor? Transfer haberleri. Bir ileri, iki geri... Başlıyoruz! CANLI:",305,8,#okanburuk+#abdullahkavukcu,136000.0,57.0,0.0,galatasaray da neler oluyor transfer haberleri bir ileri iki geri başlıyoruz canli
620,2026-07-10,ukarakullukcu,"Güne Ugochukwu hamlesini beğenmediğim için yüzlerce hakaretle uyandım... Yönetim sonuna kadar haklıymış beklemekte, iki ay tatil yapmakta... Bir Ugochukwu kiralamasıyla her şey çözülüyorsa ben haksızmışım demek ki, bundan sonra ağzımı bile açmam, he der geçerim.",2000,106,hashtagsiz-transfer,163300.0,629.0,0.0,güne ugochukwu hamlesini beğenmediğim için yüzlerce hakaretle uyandım yönetim sonuna kadar haklıymış beklemekte iki ay tatil yapmakta bir ugochukwu kiralamasıyla her şey çözülüyorsa ben haksızmışım demek ki bundan sonra ağzımı bile açmam he der geçerim
621,2026-07-10,eerena1923,Bende gelmesini öle bayıla istemiyorum ama brunley eşşek chelasea eşşek Fransa alt yaş takımları eşşek salihden İsmail'den kötü adam premier lig de 35 maç oynatıyorlar bu kadar adam görmüyor sen görüyorsun. Diye bilirsin ki adam hantal iyi pasör değil vb ama sen adamı gömüyon.,0,0,hashtagsiz-transfer,44.0,0.0,0.0,bende gelmesini öle bayıla istemiyorum ama brunley eşşek chelasea eşşek fransa alt yaş takımları eşşek salihden i̇smail den kötü adam premier lig de maç oynatıyorlar bu kadar adam görmüyor sen görüyorsun diye bilirsin ki adam hantal iyi pasör değil vb ama sen adamı gömüyon
622,2026-07-10,cpturgenov,"Hakarete falan uğramadın, sen eleştiri kabul eden bi adam değilsin Uğur. Jelert transferinde Jelert'i ne kadar şişirdiğini herkes biliyor ama senin işin etkileşim, etkileşim almak için altını dolduramadığın boş cümleler kuruyorsun. Futbol işini azalt biraz.",248,1,hashtagsiz-transfer,2000.0,3.0,0.0,hakarete falan uğramadın sen eleştiri kabul eden bi adam değilsin uğur jelert transferinde jelert i ne kadar şişirdiğini herkes biliyor ama senin işin etkileşim etkileşim almak için altını dolduramadığın boş cümleler kuruyorsun futbol işini azalt biraz
623,2026-07-10,EddieGluskin20,İnsanlar yapılqn yoruma katılmayınca hakaret ederek bunu belirtiyor bu yanlış yoksa zaten bir oyuncu hakkında birden fazla görüş olabilir. Mesela ben ismail yüksek 3 gömlek üstün yorumunu abartılı buluyorum ismail azıcık baskı yiyince inanılmaz panikliyor bu adamın tekniği iyi.,2,0,hashtagsiz-transfer,490.0,0.0,0.0,i̇nsanlar yapılqn yoruma katılmayınca hakaret ederek bunu belirtiyor bu yanlış yoksa zaten bir oyuncu hakkında birden fazla görüş olabilir mesela ben ismail yüksek gömlek üstün yorumunu abartılı buluyorum ismail azıcık baskı yiyince inanılmaz panikliyor bu adamın tekniği iyi
624,2026-07-10,ramaznkskn,Uğur hocam eleştirimiz veya beğenmeniz sorun değil. Gündemde dönen açıklamanız. İsmail yüksekten şu kadar bu kadar iyi söylemleriniz. Yani rakip topçu ile karşılaştırma yapmak yerine su su özelliği iyi değil yerine bu oyuncu olabilir şeklinde konuşman çok daha iyi olabilirdi.,2,0,hashtagsiz-transfer,392.0,1.0,0.0,uğur hocam eleştirimiz veya beğenmeniz sorun değil gündemde dönen açıklamanız i̇smail yüksekten şu kadar bu kadar iyi söylemleriniz yani rakip topçu ile karşılaştırma yapmak yerine su su özelliği iyi değil yerine bu oyuncu olabilir şeklinde konuşman çok daha iyi olabilirdi
625,2026-07-10,ilkaybyk,HAKARET ETMEK DOGRU DEGİL BENİM GÖRÜŞÜM İSMAİL YÜKSEKTENDE KÖTÜ DEĞİL LESLEY ŞAMPİYONLARLİĞİNDE YILDIZ OLUR SÜPER LİGDE FUTBOL OYNANMADIĞI İÇİN İDARE EDER,0,0,hashtagsiz-transfer,1000.0,0.0,0.0,hakaret etmek dogru degi̇l beni̇m görüşüm i̇smai̇l yüksektende kötü deği̇l lesley şampi̇yonlarli̇ği̇nde yildiz olur süper li̇gde futbol oynanmadiği i̇çi̇n i̇dare eder
626,2026-07-10,mehmet80177816,Ben şahsen senin futbol bilgine inanmıyorum bi bok anlasaydın a spor da günlerce Tarık çamdal güzellemesi yapmazdın ayrıca jelerti öyle bir güzelliyordunki her jelerti gördüğümde sana küfrediyorum utanmaz adam bari yorum yapma seni dinleyen de gerizekalıdır,0,0,hashtagsiz-transfer,72.0,0.0,0.0,ben şahsen senin futbol bilgine inanmıyorum bi bok anlasaydın a spor da günlerce tarık çamdal güzellemesi yapmazdın ayrıca jelerti öyle bir güzelliyordunki her jelerti gördüğümde sana küfrediyorum utanmaz adam bari yorum yapma seni dinleyen de gerizekalıdır
627,2026-07-10,Quanchepp,"22 yaşına kadar 55 m eur bonservisine ücret ödenmiş olan, potansiyelli, +4 kontenjanına uyan bir adam alındı. Ve bu sezon limite yansımayacak bonservisi. Her işi boklamaya bayılıyorsun. Oyuncu alınsa suç alınmasa suç. Ne istiyorsun oğlum sen? Bir de trip atıyorsun :D",0,0,hashtagsiz-transfer,615.0,0.0,0.0,yaşına kadar m eur bonservisine ücret ödenmiş olan potansiyelli kontenjanına uyan bir adam alındı ve bu sezon limite yansımayacak bonservisi her işi boklamaya bayılıyorsun oyuncu alınsa suç alınmasa suç ne istiyorsun oğlum sen bir de trip atıyorsun d
628,2026-07-10,essizshipper1,Sanki ugochukwu transferi ile transferi ile kapatmışız gibi davranman abartı değil mi sence ayrıca 23 yaşa uyuyor zorunlu değil daha ne olacak ?,0,0,hashtagsiz-transfer,131.0,0.0,0.0,sanki ugochukwu transferi ile transferi ile kapatmışız gibi davranman abartı değil mi sence ayrıca yaşa uyuyor zorunlu değil daha ne olacak
629,2026-07-10,furkankalfali,Yanlış yorumladın çünkü. Adam Nhaga yerine alınmadı ki. Lemina yerine alındı. Kural yüzünden alındı. Kulüp bu u23lerin hiç birini ilk 11 e düşünmüyor zaten yedek düşünüyor. Ondan çok para vermek istemiyor. Kulüp lemina ve icardinin yerini u23 le dolduracak işte. Transferler sonra,0,0,hashtagsiz-transfer,58.0,0.0,0.0,yanlış yorumladın çünkü adam nhaga yerine alınmadı ki lemina yerine alındı kural yüzünden alındı kulüp bu ulerin hiç birini ilk e düşünmüyor zaten yedek düşünüyor ondan çok para vermek istemiyor kulüp lemina ve icardinin yerini u le dolduracak işte transferler sonra
630,2026-07-10,black14917,"Ya bi siktir git her sezon yangın peşindesin Ulan herşeyi gectim chelseanin 27 milyon € Burnley in 25 milyon € bonservis ödediği fransa u23 oyuncusuna 5 milyonluk adam dedin a.k chelsenin,burnleyin futbol aklı demmeki senin kadar futboldan anlamıyo",1,0,hashtagsiz-transfer,581.0,0.0,0.0,ya bi siktir git her sezon yangın peşindesin ulan herşeyi gectim chelseanin milyon burnley in milyon bonservis ödediği fransa u oyuncusuna milyonluk adam dedin a k chelsenin burnleyin futbol aklı demmeki senin kadar futboldan anlamıyo
631,2026-07-10,EmirBoz34312809,"bos bos konusuyosun anca, adam 23 kuralına uygun kiralık bedelle geliyor mali olarak elini kolunu bağlamıyor fiziksel özellikleri bizim lige gayet uygun bu sanki herife 30-40 verdik aldık tutmazsa gidecek zaten transfer dönemi bittiğnde baska kimse gelmezse elestirirsin+",0,0,hashtagsiz-transfer,1000.0,1.0,0.0,bos bos konusuyosun anca adam kuralına uygun kiralık bedelle geliyor mali olarak elini kolunu bağlamıyor fiziksel özellikleri bizim lige gayet uygun bu sanki herife verdik aldık tutmazsa gidecek zaten transfer dönemi bittiğnde baska kimse gelmezse elestirirsin
632,2026-07-10,SeferZahidov90,Ulan şerefsiz fenerbahçe bir kötü transfer etdiyinde hiç bi zaman böyle yerin dibine sokmadın ancak Galatasaraya ağzına geleni konuşa biliyorsun,2,0,hashtagsiz-transfer,1000.0,3.0,0.0,ulan şerefsiz fenerbahçe bir kötü transfer etdiyinde hiç bi zaman böyle yerin dibine sokmadın ancak galatasaraya ağzına geleni konuşa biliyorsun
633,2026-07-10,EmreAlb96952939,Kardeşim okey beğenmeme nedenlerine okeyim haklı çıkma ihtimalinde yüksek ama çıkıp gs Salih'i alması lazım diyende sensin lemina toreira olduğu yere en şişik bölgeye Salih deyince bende lesleyi eleştirmen de bitiyor Malasef,1,0,hashtagsiz-transfer,1000.0,3.0,0.0,kardeşim okey beğenmeme nedenlerine okeyim haklı çıkma ihtimalinde yüksek ama çıkıp gs salih i alması lazım diyende sensin lemina toreira olduğu yere en şişik bölgeye salih deyince bende lesleyi eleştirmen de bitiyor malasef
634,2026-07-10,lamakayali,elinde rotasyon olarak toreira ve lemina ngaha ve sara var alternatif olarak kullanmak 2 milyon gibi bir kiralama bedelli oyuncu ucl var lig var niye direkt as oyuncu muammelesi çekiyorsunuz ki,2,0,hashtagsiz-transfer,601.0,0.0,0.0,elinde rotasyon olarak toreira ve lemina ngaha ve sara var alternatif olarak kullanmak milyon gibi bir kiralama bedelli oyuncu ucl var lig var niye direkt as oyuncu muammelesi çekiyorsunuz ki
